No.     Time                          Source                Destination           Protocol Length Info                                                            新規列
      1 2023-09-15 15:09:22.627945    Panasoni_36:d3:b8     Panasoni_04:92:b4     LOOP     64     No valid function found                                         1

Frame 1: 64 bytes on wire (512 bits), 64 bytes captured (512 bits)
Ethernet II, Src: Panasoni_36:d3:b8 (00:c0:8f:36:d3:b8), Dst: Panasoni_04:92:b4 (00:c0:8f:04:92:b4)
Configuration Test Protocol (loopback)
Data (46 bytes)

0000  00 00 00 00 00 00 00 00 00 00 00 00 00 00 00 00   ................
0010  00 00 00 00 00 00 00 00 00 00 00 00 00 00 00 00   ................
0020  00 00 00 00 00 00 00 00 00 00 00 00 00 00         ..............

No.     Time                          Source                Destination           Protocol Length Info                                                            新規列
      2 2023-09-15 15:09:22.728117    172.31.237.60         224.0.0.18            VRRP     60     Announcement (v2)                                               2

Frame 2: 60 bytes on wire (480 bits), 60 bytes captured (480 bits)
Ethernet II, Src: IETF-VRRP-VRID_0a (00:00:5e:00:01:0a), Dst: IPv4mcast_12 (01:00:5e:00:00:12)
Internet Protocol Version 4, Src: 172.31.237.60, Dst: 224.0.0.18
Virtual Router Redundancy Protocol

No.     Time                          Source                Destination           Protocol Length Info                                                            新規列
      3 2023-09-15 15:09:23.728086    172.31.237.60         224.0.0.18            VRRP     60     Announcement (v2)                                               3

Frame 3: 60 bytes on wire (480 bits), 60 bytes captured (480 bits)
Ethernet II, Src: IETF-VRRP-VRID_0a (00:00:5e:00:01:0a), Dst: IPv4mcast_12 (01:00:5e:00:00:12)
Internet Protocol Version 4, Src: 172.31.237.60, Dst: 224.0.0.18
Virtual Router Redundancy Protocol

No.     Time                          Source                Destination           Protocol Length Info                                                            新規列
      4 2023-09-15 15:09:24.728110    172.31.237.60         224.0.0.18            VRRP     60     Announcement (v2)                                               4

Frame 4: 60 bytes on wire (480 bits), 60 bytes captured (480 bits)
Ethernet II, Src: IETF-VRRP-VRID_0a (00:00:5e:00:01:0a), Dst: IPv4mcast_12 (01:00:5e:00:00:12)
Internet Protocol Version 4, Src: 172.31.237.60, Dst: 224.0.0.18
Virtual Router Redundancy Protocol

No.     Time                          Source                Destination           Protocol Length Info                                                            新規列
      5 2023-09-15 15:09:25.728126    172.31.237.60         224.0.0.18            VRRP     60     Announcement (v2)                                               5

Frame 5: 60 bytes on wire (480 bits), 60 bytes captured (480 bits)
Ethernet II, Src: IETF-VRRP-VRID_0a (00:00:5e:00:01:0a), Dst: IPv4mcast_12 (01:00:5e:00:00:12)
Internet Protocol Version 4, Src: 172.31.237.60, Dst: 224.0.0.18
Virtual Router Redundancy Protocol

No.     Time                          Source                Destination           Protocol Length Info                                                            新規列
      6 2023-09-15 15:09:26.728116    172.31.237.60         224.0.0.18            VRRP     60     Announcement (v2)                                               6

Frame 6: 60 bytes on wire (480 bits), 60 bytes captured (480 bits)
Ethernet II, Src: IETF-VRRP-VRID_0a (00:00:5e:00:01:0a), Dst: IPv4mcast_12 (01:00:5e:00:00:12)
Internet Protocol Version 4, Src: 172.31.237.60, Dst: 224.0.0.18
Virtual Router Redundancy Protocol

No.     Time                          Source                Destination           Protocol Length Info                                                            新規列
      7 2023-09-15 15:09:27.728154    172.31.237.60         224.0.0.18            VRRP     60     Announcement (v2)                                               7

Frame 7: 60 bytes on wire (480 bits), 60 bytes captured (480 bits)
Ethernet II, Src: IETF-VRRP-VRID_0a (00:00:5e:00:01:0a), Dst: IPv4mcast_12 (01:00:5e:00:00:12)
Internet Protocol Version 4, Src: 172.31.237.60, Dst: 224.0.0.18
Virtual Router Redundancy Protocol

No.     Time                          Source                Destination           Protocol Length Info                                                            新規列
      8 2023-09-15 15:09:28.514233    172.31.237.13         239.255.255.250       SSDP     217    M-SEARCH * HTTP/1.1                                             8

Frame 8: 217 bytes on wire (1736 bits), 217 bytes captured (1736 bits)
Ethernet II, Src: ToshibaC_f7:38:1e (68:45:f1:f7:38:1e), Dst: IPv4mcast_7f:ff:fa (01:00:5e:7f:ff:fa)
Internet Protocol Version 4, Src: 172.31.237.13, Dst: 239.255.255.250
User Datagram Protocol, Src Port: 54714, Dst Port: 1900
Simple Service Discovery Protocol

No.     Time                          Source                Destination           Protocol Length Info                                                            新規列
      9 2023-09-15 15:09:28.561088    172.31.237.13         239.255.255.250       SSDP     217    M-SEARCH * HTTP/1.1                                             9

Frame 9: 217 bytes on wire (1736 bits), 217 bytes captured (1736 bits)
Ethernet II, Src: ToshibaC_f7:38:1e (68:45:f1:f7:38:1e), Dst: IPv4mcast_7f:ff:fa (01:00:5e:7f:ff:fa)
Internet Protocol Version 4, Src: 172.31.237.13, Dst: 239.255.255.250
User Datagram Protocol, Src Port: 54717, Dst Port: 1900
Simple Service Discovery Protocol

No.     Time                          Source                Destination           Protocol Length Info                                                            新規列
     10 2023-09-15 15:09:28.728157    172.31.237.60         224.0.0.18            VRRP     60     Announcement (v2)                                               10

Frame 10: 60 bytes on wire (480 bits), 60 bytes captured (480 bits)
Ethernet II, Src: IETF-VRRP-VRID_0a (00:00:5e:00:01:0a), Dst: IPv4mcast_12 (01:00:5e:00:00:12)
Internet Protocol Version 4, Src: 172.31.237.60, Dst: 224.0.0.18
Virtual Router Redundancy Protocol

No.     Time                          Source                Destination           Protocol Length Info                                                            新規列
     11 2023-09-15 15:09:29.522452    172.31.237.13         239.255.255.250       SSDP     217    M-SEARCH * HTTP/1.1                                             11

Frame 11: 217 bytes on wire (1736 bits), 217 bytes captured (1736 bits)
Ethernet II, Src: ToshibaC_f7:38:1e (68:45:f1:f7:38:1e), Dst: IPv4mcast_7f:ff:fa (01:00:5e:7f:ff:fa)
Internet Protocol Version 4, Src: 172.31.237.13, Dst: 239.255.255.250
User Datagram Protocol, Src Port: 54714, Dst Port: 1900
Simple Service Discovery Protocol

No.     Time                          Source                Destination           Protocol Length Info                                                            新規列
     12 2023-09-15 15:09:29.571181    172.31.237.13         239.255.255.250       SSDP     217    M-SEARCH * HTTP/1.1                                             12

Frame 12: 217 bytes on wire (1736 bits), 217 bytes captured (1736 bits)
Ethernet II, Src: ToshibaC_f7:38:1e (68:45:f1:f7:38:1e), Dst: IPv4mcast_7f:ff:fa (01:00:5e:7f:ff:fa)
Internet Protocol Version 4, Src: 172.31.237.13, Dst: 239.255.255.250
User Datagram Protocol, Src Port: 54717, Dst Port: 1900
Simple Service Discovery Protocol

No.     Time                          Source                Destination           Protocol Length Info                                                            新規列
     13 2023-09-15 15:09:29.728125    172.31.237.60         224.0.0.18            VRRP     60     Announcement (v2)                                               13

Frame 13: 60 bytes on wire (480 bits), 60 bytes captured (480 bits)
Ethernet II, Src: IETF-VRRP-VRID_0a (00:00:5e:00:01:0a), Dst: IPv4mcast_12 (01:00:5e:00:00:12)
Internet Protocol Version 4, Src: 172.31.237.60, Dst: 224.0.0.18
Virtual Router Redundancy Protocol

No.     Time                          Source                Destination           Protocol Length Info                                                            新規列
     14 2023-09-15 15:09:30.534339    172.31.237.13         239.255.255.250       SSDP     217    M-SEARCH * HTTP/1.1                                             14

Frame 14: 217 bytes on wire (1736 bits), 217 bytes captured (1736 bits)
Ethernet II, Src: ToshibaC_f7:38:1e (68:45:f1:f7:38:1e), Dst: IPv4mcast_7f:ff:fa (01:00:5e:7f:ff:fa)
Internet Protocol Version 4, Src: 172.31.237.13, Dst: 239.255.255.250
User Datagram Protocol, Src Port: 54714, Dst Port: 1900
Simple Service Discovery Protocol

No.     Time                          Source                Destination           Protocol Length Info                                                            新規列
     15 2023-09-15 15:09:30.590094    172.31.237.13         239.255.255.250       SSDP     217    M-SEARCH * HTTP/1.1                                             15

Frame 15: 217 bytes on wire (1736 bits), 217 bytes captured (1736 bits)
Ethernet II, Src: ToshibaC_f7:38:1e (68:45:f1:f7:38:1e), Dst: IPv4mcast_7f:ff:fa (01:00:5e:7f:ff:fa)
Internet Protocol Version 4, Src: 172.31.237.13, Dst: 239.255.255.250
User Datagram Protocol, Src Port: 54717, Dst Port: 1900
Simple Service Discovery Protocol

No.     Time                          Source                Destination           Protocol Length Info                                                            新規列
     16 2023-09-15 15:09:30.728173    172.31.237.60         224.0.0.18            VRRP     60     Announcement (v2)                                               16

Frame 16: 60 bytes on wire (480 bits), 60 bytes captured (480 bits)
Ethernet II, Src: IETF-VRRP-VRID_0a (00:00:5e:00:01:0a), Dst: IPv4mcast_12 (01:00:5e:00:00:12)
Internet Protocol Version 4, Src: 172.31.237.60, Dst: 224.0.0.18
Virtual Router Redundancy Protocol

No.     Time                          Source                Destination           Protocol Length Info                                                            新規列
     17 2023-09-15 15:09:31.549821    172.31.237.13         239.255.255.250       SSDP     217    M-SEARCH * HTTP/1.1                                             17

Frame 17: 217 bytes on wire (1736 bits), 217 bytes captured (1736 bits)
Ethernet II, Src: ToshibaC_f7:38:1e (68:45:f1:f7:38:1e), Dst: IPv4mcast_7f:ff:fa (01:00:5e:7f:ff:fa)
Internet Protocol Version 4, Src: 172.31.237.13, Dst: 239.255.255.250
User Datagram Protocol, Src Port: 54714, Dst Port: 1900
Simple Service Discovery Protocol

No.     Time                          Source                Destination           Protocol Length Info                                                            新規列
     18 2023-09-15 15:09:31.599411    172.31.237.13         239.255.255.250       SSDP     217    M-SEARCH * HTTP/1.1                                             18

Frame 18: 217 bytes on wire (1736 bits), 217 bytes captured (1736 bits)
Ethernet II, Src: ToshibaC_f7:38:1e (68:45:f1:f7:38:1e), Dst: IPv4mcast_7f:ff:fa (01:00:5e:7f:ff:fa)
Internet Protocol Version 4, Src: 172.31.237.13, Dst: 239.255.255.250
User Datagram Protocol, Src Port: 54717, Dst Port: 1900
Simple Service Discovery Protocol

No.     Time                          Source                Destination           Protocol Length Info                                                            新規列
     19 2023-09-15 15:09:31.728171    172.31.237.60         224.0.0.18            VRRP     60     Announcement (v2)                                               19

Frame 19: 60 bytes on wire (480 bits), 60 bytes captured (480 bits)
Ethernet II, Src: IETF-VRRP-VRID_0a (00:00:5e:00:01:0a), Dst: IPv4mcast_12 (01:00:5e:00:00:12)
Internet Protocol Version 4, Src: 172.31.237.60, Dst: 224.0.0.18
Virtual Router Redundancy Protocol

No.     Time                          Source                Destination           Protocol Length Info                                                            新規列
     20 2023-09-15 15:09:32.693288    Panasoni_36:d3:b8     Panasoni_04:92:b4     LOOP     64     No valid function found                                         20

Frame 20: 64 bytes on wire (512 bits), 64 bytes captured (512 bits)
Ethernet II, Src: Panasoni_36:d3:b8 (00:c0:8f:36:d3:b8), Dst: Panasoni_04:92:b4 (00:c0:8f:04:92:b4)
Configuration Test Protocol (loopback)
Data (46 bytes)

0000  00 00 00 00 00 00 00 00 00 00 00 00 00 00 00 00   ................
0010  00 00 00 00 00 00 00 00 00 00 00 00 00 00 00 00   ................
0020  00 00 00 00 00 00 00 00 00 00 00 00 00 00         ..............

No.     Time                          Source                Destination           Protocol Length Info                                                            新規列
     21 2023-09-15 15:09:32.728219    172.31.237.60         224.0.0.18            VRRP     60     Announcement (v2)                                               21

Frame 21: 60 bytes on wire (480 bits), 60 bytes captured (480 bits)
Ethernet II, Src: IETF-VRRP-VRID_0a (00:00:5e:00:01:0a), Dst: IPv4mcast_12 (01:00:5e:00:00:12)
Internet Protocol Version 4, Src: 172.31.237.60, Dst: 224.0.0.18
Virtual Router Redundancy Protocol

No.     Time                          Source                Destination           Protocol Length Info                                                            新規列
     22 2023-09-15 15:09:33.728183    172.31.237.60         224.0.0.18            VRRP     60     Announcement (v2)                                               22

Frame 22: 60 bytes on wire (480 bits), 60 bytes captured (480 bits)
Ethernet II, Src: IETF-VRRP-VRID_0a (00:00:5e:00:01:0a), Dst: IPv4mcast_12 (01:00:5e:00:00:12)
Internet Protocol Version 4, Src: 172.31.237.60, Dst: 224.0.0.18
Virtual Router Redundancy Protocol

No.     Time                          Source                Destination           Protocol Length Info                                                            新規列
     23 2023-09-15 15:09:34.631370    172.31.237.13         172.20.100.3          TCP      55     13926 → 61443 [ACK] Seq=1 Ack=1 Win=512 Len=1                 23

Frame 23: 55 bytes on wire (440 bits), 55 bytes captured (440 bits)
Ethernet II, Src: ToshibaC_f7:38:1e (68:45:f1:f7:38:1e), Dst: IETF-VRRP-VRID_0a (00:00:5e:00:01:0a)
Internet Protocol Version 4, Src: 172.31.237.13, Dst: 172.20.100.3
Transmission Control Protocol, Src Port: 13926, Dst Port: 61443, Seq: 1, Ack: 1, Len: 1
Data (1 byte)

0000  00                                                .

No.     Time                          Source                Destination           Protocol Length Info                                                            新規列
     24 2023-09-15 15:09:34.635946    172.20.100.3          172.31.237.13         TCP      60     61443 → 13926 [ACK] Seq=1 Ack=2 Win=8680 Len=0                24

Frame 24: 60 bytes on wire (480 bits), 60 bytes captured (480 bits)
Ethernet II, Src: Yamaha_6f:82:c3 (ac:44:f2:6f:82:c3), Dst: ToshibaC_f7:38:1e (68:45:f1:f7:38:1e)
Internet Protocol Version 4, Src: 172.20.100.3, Dst: 172.31.237.13
Transmission Control Protocol, Src Port: 61443, Dst Port: 13926, Seq: 1, Ack: 2, Len: 0

No.     Time                          Source                Destination           Protocol Length Info                                                            新規列
     25 2023-09-15 15:09:34.728238    172.31.237.60         224.0.0.18            VRRP     60     Announcement (v2)                                               25

Frame 25: 60 bytes on wire (480 bits), 60 bytes captured (480 bits)
Ethernet II, Src: IETF-VRRP-VRID_0a (00:00:5e:00:01:0a), Dst: IPv4mcast_12 (01:00:5e:00:00:12)
Internet Protocol Version 4, Src: 172.31.237.60, Dst: 224.0.0.18
Virtual Router Redundancy Protocol

No.     Time                          Source                Destination           Protocol Length Info                                                            新規列
     26 2023-09-15 15:09:35.728168    172.31.237.60         224.0.0.18            VRRP     60     Announcement (v2)                                               26

Frame 26: 60 bytes on wire (480 bits), 60 bytes captured (480 bits)
Ethernet II, Src: IETF-VRRP-VRID_0a (00:00:5e:00:01:0a), Dst: IPv4mcast_12 (01:00:5e:00:00:12)
Internet Protocol Version 4, Src: 172.31.237.60, Dst: 224.0.0.18
Virtual Router Redundancy Protocol

No.     Time                          Source                Destination           Protocol Length Info                                                            新規列
     27 2023-09-15 15:09:36.728211    172.31.237.60         224.0.0.18            VRRP     60     Announcement (v2)                                               27

Frame 27: 60 bytes on wire (480 bits), 60 bytes captured (480 bits)
Ethernet II, Src: IETF-VRRP-VRID_0a (00:00:5e:00:01:0a), Dst: IPv4mcast_12 (01:00:5e:00:00:12)
Internet Protocol Version 4, Src: 172.31.237.60, Dst: 224.0.0.18
Virtual Router Redundancy Protocol

No.     Time                          Source                Destination           Protocol Length Info                                                            新規列
     28 2023-09-15 15:09:37.728247    172.31.237.60         224.0.0.18            VRRP     60     Announcement (v2)                                               28

Frame 28: 60 bytes on wire (480 bits), 60 bytes captured (480 bits)
Ethernet II, Src: IETF-VRRP-VRID_0a (00:00:5e:00:01:0a), Dst: IPv4mcast_12 (01:00:5e:00:00:12)
Internet Protocol Version 4, Src: 172.31.237.60, Dst: 224.0.0.18
Virtual Router Redundancy Protocol

No.     Time                          Source                Destination           Protocol Length Info                                                            新規列
     29 2023-09-15 15:09:38.728230    172.31.237.60         224.0.0.18            VRRP     60     Announcement (v2)                                               29

Frame 29: 60 bytes on wire (480 bits), 60 bytes captured (480 bits)
Ethernet II, Src: IETF-VRRP-VRID_0a (00:00:5e:00:01:0a), Dst: IPv4mcast_12 (01:00:5e:00:00:12)
Internet Protocol Version 4, Src: 172.31.237.60, Dst: 224.0.0.18
Virtual Router Redundancy Protocol

No.     Time                          Source                Destination           Protocol Length Info                                                            新規列
     30 2023-09-15 15:09:39.728230    172.31.237.60         224.0.0.18            VRRP     60     Announcement (v2)                                               30

Frame 30: 60 bytes on wire (480 bits), 60 bytes captured (480 bits)
Ethernet II, Src: IETF-VRRP-VRID_0a (00:00:5e:00:01:0a), Dst: IPv4mcast_12 (01:00:5e:00:00:12)
Internet Protocol Version 4, Src: 172.31.237.60, Dst: 224.0.0.18
Virtual Router Redundancy Protocol

No.     Time                          Source                Destination           Protocol Length Info                                                            新規列
     31 2023-09-15 15:09:40.728258    172.31.237.60         224.0.0.18            VRRP     60     Announcement (v2)                                               31

Frame 31: 60 bytes on wire (480 bits), 60 bytes captured (480 bits)
Ethernet II, Src: IETF-VRRP-VRID_0a (00:00:5e:00:01:0a), Dst: IPv4mcast_12 (01:00:5e:00:00:12)
Internet Protocol Version 4, Src: 172.31.237.60, Dst: 224.0.0.18
Virtual Router Redundancy Protocol

No.     Time                          Source                Destination           Protocol Length Info                                                            新規列
     32 2023-09-15 15:09:41.728240    172.31.237.60         224.0.0.18            VRRP     60     Announcement (v2)                                               32

Frame 32: 60 bytes on wire (480 bits), 60 bytes captured (480 bits)
Ethernet II, Src: IETF-VRRP-VRID_0a (00:00:5e:00:01:0a), Dst: IPv4mcast_12 (01:00:5e:00:00:12)
Internet Protocol Version 4, Src: 172.31.237.60, Dst: 224.0.0.18
Virtual Router Redundancy Protocol

No.     Time                          Source                Destination           Protocol Length Info                                                            新規列
     33 2023-09-15 15:09:42.727262    172.31.237.60         224.0.0.18            VRRP     60     Announcement (v2)                                               33

Frame 33: 60 bytes on wire (480 bits), 60 bytes captured (480 bits)
Ethernet II, Src: IETF-VRRP-VRID_0a (00:00:5e:00:01:0a), Dst: IPv4mcast_12 (01:00:5e:00:00:12)
Internet Protocol Version 4, Src: 172.31.237.60, Dst: 224.0.0.18
Virtual Router Redundancy Protocol

No.     Time                          Source                Destination           Protocol Length Info                                                            新規列
     34 2023-09-15 15:09:42.735772    Panasoni_36:d3:b8     Panasoni_04:92:b4     LOOP     64     No valid function found                                         34

Frame 34: 64 bytes on wire (512 bits), 64 bytes captured (512 bits)
Ethernet II, Src: Panasoni_36:d3:b8 (00:c0:8f:36:d3:b8), Dst: Panasoni_04:92:b4 (00:c0:8f:04:92:b4)
Configuration Test Protocol (loopback)
Data (46 bytes)

0000  00 00 00 00 00 00 00 00 00 00 00 00 00 00 00 00   ................
0010  00 00 00 00 00 00 00 00 00 00 00 00 00 00 00 00   ................
0020  00 00 00 00 00 00 00 00 00 00 00 00 00 00         ..............

No.     Time                          Source                Destination           Protocol Length Info                                                            新規列
     35 2023-09-15 15:09:43.727208    172.31.237.60         224.0.0.18            VRRP     60     Announcement (v2)                                               35

Frame 35: 60 bytes on wire (480 bits), 60 bytes captured (480 bits)
Ethernet II, Src: IETF-VRRP-VRID_0a (00:00:5e:00:01:0a), Dst: IPv4mcast_12 (01:00:5e:00:00:12)
Internet Protocol Version 4, Src: 172.31.237.60, Dst: 224.0.0.18
Virtual Router Redundancy Protocol

No.     Time                          Source                Destination           Protocol Length Info                                                            新規列
     36 2023-09-15 15:09:44.727292    172.31.237.60         224.0.0.18            VRRP     60     Announcement (v2)                                               36

Frame 36: 60 bytes on wire (480 bits), 60 bytes captured (480 bits)
Ethernet II, Src: IETF-VRRP-VRID_0a (00:00:5e:00:01:0a), Dst: IPv4mcast_12 (01:00:5e:00:00:12)
Internet Protocol Version 4, Src: 172.31.237.60, Dst: 224.0.0.18
Virtual Router Redundancy Protocol

No.     Time                          Source                Destination           Protocol Length Info                                                            新規列
     37 2023-09-15 15:09:45.727518    172.31.237.60         224.0.0.18            VRRP     60     Announcement (v2)                                               37

Frame 37: 60 bytes on wire (480 bits), 60 bytes captured (480 bits)
Ethernet II, Src: IETF-VRRP-VRID_0a (00:00:5e:00:01:0a), Dst: IPv4mcast_12 (01:00:5e:00:00:12)
Internet Protocol Version 4, Src: 172.31.237.60, Dst: 224.0.0.18
Virtual Router Redundancy Protocol

No.     Time                          Source                Destination           Protocol Length Info                                                            新規列
     38 2023-09-15 15:09:46.727574    172.31.237.60         224.0.0.18            VRRP     60     Announcement (v2)                                               38

Frame 38: 60 bytes on wire (480 bits), 60 bytes captured (480 bits)
Ethernet II, Src: IETF-VRRP-VRID_0a (00:00:5e:00:01:0a), Dst: IPv4mcast_12 (01:00:5e:00:00:12)
Internet Protocol Version 4, Src: 172.31.237.60, Dst: 224.0.0.18
Virtual Router Redundancy Protocol

No.     Time                          Source                Destination           Protocol Length Info                                                            新規列
     39 2023-09-15 15:09:47.727568    172.31.237.60         224.0.0.18            VRRP     60     Announcement (v2)                                               39

Frame 39: 60 bytes on wire (480 bits), 60 bytes captured (480 bits)
Ethernet II, Src: IETF-VRRP-VRID_0a (00:00:5e:00:01:0a), Dst: IPv4mcast_12 (01:00:5e:00:00:12)
Internet Protocol Version 4, Src: 172.31.237.60, Dst: 224.0.0.18
Virtual Router Redundancy Protocol

No.     Time                          Source                Destination           Protocol Length Info                                                            新規列
     40 2023-09-15 15:09:48.727406    172.31.237.60         224.0.0.18            VRRP     60     Announcement (v2)                                               40

Frame 40: 60 bytes on wire (480 bits), 60 bytes captured (480 bits)
Ethernet II, Src: IETF-VRRP-VRID_0a (00:00:5e:00:01:0a), Dst: IPv4mcast_12 (01:00:5e:00:00:12)
Internet Protocol Version 4, Src: 172.31.237.60, Dst: 224.0.0.18
Virtual Router Redundancy Protocol

No.     Time                          Source                Destination           Protocol Length Info                                                            新規列
     41 2023-09-15 15:09:49.727519    172.31.237.60         224.0.0.18            VRRP     60     Announcement (v2)                                               41

Frame 41: 60 bytes on wire (480 bits), 60 bytes captured (480 bits)
Ethernet II, Src: IETF-VRRP-VRID_0a (00:00:5e:00:01:0a), Dst: IPv4mcast_12 (01:00:5e:00:00:12)
Internet Protocol Version 4, Src: 172.31.237.60, Dst: 224.0.0.18
Virtual Router Redundancy Protocol

No.     Time                          Source                Destination           Protocol Length Info                                                            新規列
     42 2023-09-15 15:09:50.727560    172.31.237.60         224.0.0.18            VRRP     60     Announcement (v2)                                               42

Frame 42: 60 bytes on wire (480 bits), 60 bytes captured (480 bits)
Ethernet II, Src: IETF-VRRP-VRID_0a (00:00:5e:00:01:0a), Dst: IPv4mcast_12 (01:00:5e:00:00:12)
Internet Protocol Version 4, Src: 172.31.237.60, Dst: 224.0.0.18
Virtual Router Redundancy Protocol

No.     Time                          Source                Destination           Protocol Length Info                                                            新規列
     43 2023-09-15 15:09:51.727337    172.31.237.60         224.0.0.18            VRRP     60     Announcement (v2)                                               43

Frame 43: 60 bytes on wire (480 bits), 60 bytes captured (480 bits)
Ethernet II, Src: IETF-VRRP-VRID_0a (00:00:5e:00:01:0a), Dst: IPv4mcast_12 (01:00:5e:00:00:12)
Internet Protocol Version 4, Src: 172.31.237.60, Dst: 224.0.0.18
Virtual Router Redundancy Protocol

No.     Time                          Source                Destination           Protocol Length Info                                                            新規列
     44 2023-09-15 15:09:52.727685    172.31.237.60         224.0.0.18            VRRP     60     Announcement (v2)                                               44

Frame 44: 60 bytes on wire (480 bits), 60 bytes captured (480 bits)
Ethernet II, Src: IETF-VRRP-VRID_0a (00:00:5e:00:01:0a), Dst: IPv4mcast_12 (01:00:5e:00:00:12)
Internet Protocol Version 4, Src: 172.31.237.60, Dst: 224.0.0.18
Virtual Router Redundancy Protocol

No.     Time                          Source                Destination           Protocol Length Info                                                            新規列
     45 2023-09-15 15:09:52.792993    Panasoni_36:d3:b8     Panasoni_04:92:b4     LOOP     64     No valid function found                                         45

Frame 45: 64 bytes on wire (512 bits), 64 bytes captured (512 bits)
Ethernet II, Src: Panasoni_36:d3:b8 (00:c0:8f:36:d3:b8), Dst: Panasoni_04:92:b4 (00:c0:8f:04:92:b4)
Configuration Test Protocol (loopback)
Data (46 bytes)

0000  00 00 00 00 00 00 00 00 00 00 00 00 00 00 00 00   ................
0010  00 00 00 00 00 00 00 00 00 00 00 00 00 00 00 00   ................
0020  00 00 00 00 00 00 00 00 00 00 00 00 00 00         ..............

No.     Time                          Source                Destination           Protocol Length Info                                                            新規列
     46 2023-09-15 15:09:53.727383    172.31.237.60         224.0.0.18            VRRP     60     Announcement (v2)                                               46

Frame 46: 60 bytes on wire (480 bits), 60 bytes captured (480 bits)
Ethernet II, Src: IETF-VRRP-VRID_0a (00:00:5e:00:01:0a), Dst: IPv4mcast_12 (01:00:5e:00:00:12)
Internet Protocol Version 4, Src: 172.31.237.60, Dst: 224.0.0.18
Virtual Router Redundancy Protocol

No.     Time                          Source                Destination           Protocol Length Info                                                            新規列
     47 2023-09-15 15:09:54.521796    172.31.237.13         172.20.100.3          H.225.0  96     CS: empty                                                       47

Frame 47: 96 bytes on wire (768 bits), 96 bytes captured (768 bits)
Ethernet II, Src: ToshibaC_f7:38:1e (68:45:f1:f7:38:1e), Dst: IETF-VRRP-VRID_0a (00:00:5e:00:01:0a)
Internet Protocol Version 4, Src: 172.31.237.13, Dst: 172.20.100.3
Transmission Control Protocol, Src Port: 13926, Dst Port: 61443, Seq: 2, Ack: 1, Len: 42
TPKT, Version: 3, Length: 42
Q.931
H.225.0 CS

No.     Time                          Source                Destination           Protocol Length Info                                                            新規列
     48 2023-09-15 15:09:54.547626    172.20.100.3          172.31.237.13         H.225.0  113    CS: empty                                                       48

Frame 48: 113 bytes on wire (904 bits), 113 bytes captured (904 bits)
Ethernet II, Src: Yamaha_6f:82:c3 (ac:44:f2:6f:82:c3), Dst: ToshibaC_f7:38:1e (68:45:f1:f7:38:1e)
Internet Protocol Version 4, Src: 172.20.100.3, Dst: 172.31.237.13
Transmission Control Protocol, Src Port: 61443, Dst Port: 13926, Seq: 1, Ack: 44, Len: 59
TPKT, Version: 3, Length: 59
Q.931
H.225.0 CS

No.     Time                          Source                Destination           Protocol Length Info                                                            新規列
     49 2023-09-15 15:09:54.548340    172.31.237.13         172.20.100.3          H.225.0  96     CS: empty                                                       49

Frame 49: 96 bytes on wire (768 bits), 96 bytes captured (768 bits)
Ethernet II, Src: ToshibaC_f7:38:1e (68:45:f1:f7:38:1e), Dst: IETF-VRRP-VRID_0a (00:00:5e:00:01:0a)
Internet Protocol Version 4, Src: 172.31.237.13, Dst: 172.20.100.3
Transmission Control Protocol, Src Port: 13926, Dst Port: 61443, Seq: 44, Ack: 60, Len: 42
TPKT, Version: 3, Length: 42
Q.931
H.225.0 CS

No.     Time                          Source                Destination           Protocol Length Info                                                            新規列
     50 2023-09-15 15:09:54.566018    172.20.100.3          172.31.237.13         H.225.0  117    CS: empty                                                       50

Frame 50: 117 bytes on wire (936 bits), 117 bytes captured (936 bits)
Ethernet II, Src: Yamaha_6f:82:c3 (ac:44:f2:6f:82:c3), Dst: ToshibaC_f7:38:1e (68:45:f1:f7:38:1e)
Internet Protocol Version 4, Src: 172.20.100.3, Dst: 172.31.237.13
Transmission Control Protocol, Src Port: 61443, Dst Port: 13926, Seq: 60, Ack: 86, Len: 63
TPKT, Version: 3, Length: 63
Q.931
H.225.0 CS

No.     Time                          Source                Destination           Protocol Length Info                                                            新規列
     51 2023-09-15 15:09:54.566226    172.31.237.13         172.20.100.3          H.225.0  1062   CS: empty CS: empty CS: empty CS: empty CS: empty CS: empty CS: empty CS: empty CS: empty CS: empty CS: empty CS: empty CS: empty CS: empty CS: empty CS: empty CS: empty CS: empty CS: empty CS: empty CS: empty CS: empty CS: empty CS: empty  51

Frame 51: 1062 bytes on wire (8496 bits), 1062 bytes captured (8496 bits)
Ethernet II, Src: ToshibaC_f7:38:1e (68:45:f1:f7:38:1e), Dst: IETF-VRRP-VRID_0a (00:00:5e:00:01:0a)
Internet Protocol Version 4, Src: 172.31.237.13, Dst: 172.20.100.3
Transmission Control Protocol, Src Port: 13926, Dst Port: 61443, Seq: 86, Ack: 123, Len: 1008
TPKT, Version: 3, Length: 42
Q.931
H.225.0 CS
TPKT, Version: 3, Length: 42
Q.931
H.225.0 CS
TPKT, Version: 3, Length: 42
Q.931
H.225.0 CS
TPKT, Version: 3, Length: 42
Q.931
H.225.0 CS
TPKT, Version: 3, Length: 42
Q.931
H.225.0 CS
TPKT, Version: 3, Length: 42
Q.931
H.225.0 CS
TPKT, Version: 3, Length: 42
Q.931
H.225.0 CS
TPKT, Version: 3, Length: 42
Q.931
H.225.0 CS
TPKT, Version: 3, Length: 42
Q.931
H.225.0 CS
TPKT, Version: 3, Length: 42
Q.931
H.225.0 CS
TPKT, Version: 3, Length: 42
Q.931
H.225.0 CS
TPKT, Version: 3, Length: 42
Q.931
H.225.0 CS
TPKT, Version: 3, Length: 42
Q.931
H.225.0 CS
TPKT, Version: 3, Length: 42
Q.931
H.225.0 CS
TPKT, Version: 3, Length: 42
Q.931
H.225.0 CS
TPKT, Version: 3, Length: 42
Q.931
H.225.0 CS
TPKT, Version: 3, Length: 42
Q.931
H.225.0 CS
TPKT, Version: 3, Length: 42
Q.931
H.225.0 CS
TPKT, Version: 3, Length: 42
Q.931
H.225.0 CS
TPKT, Version: 3, Length: 42
Q.931
H.225.0 CS
TPKT, Version: 3, Length: 42
Q.931
H.225.0 CS
TPKT, Version: 3, Length: 42
Q.931
H.225.0 CS
TPKT, Version: 3, Length: 42
Q.931
H.225.0 CS
TPKT, Version: 3, Length: 42
Q.931
H.225.0 CS

No.     Time                          Source                Destination           Protocol Length Info                                                            新規列
     52 2023-09-15 15:09:54.566818    172.20.100.3          172.31.237.13         H.225.0  102    CS: empty                                                       52

Frame 52: 102 bytes on wire (816 bits), 102 bytes captured (816 bits)
Ethernet II, Src: Yamaha_6f:82:c3 (ac:44:f2:6f:82:c3), Dst: ToshibaC_f7:38:1e (68:45:f1:f7:38:1e)
Internet Protocol Version 4, Src: 172.20.100.3, Dst: 172.31.237.13
Transmission Control Protocol, Src Port: 61443, Dst Port: 13926, Seq: 123, Ack: 86, Len: 48
TPKT, Version: 3, Length: 48
Q.931
H.225.0 CS

No.     Time                          Source                Destination           Protocol Length Info                                                            新規列
     53 2023-09-15 15:09:54.566818    172.20.100.3          172.31.237.13         H.225.0  116    CS: empty                                                       53

Frame 53: 116 bytes on wire (928 bits), 116 bytes captured (928 bits)
Ethernet II, Src: Yamaha_6f:82:c3 (ac:44:f2:6f:82:c3), Dst: ToshibaC_f7:38:1e (68:45:f1:f7:38:1e)
Internet Protocol Version 4, Src: 172.20.100.3, Dst: 172.31.237.13
Transmission Control Protocol, Src Port: 61443, Dst Port: 13926, Seq: 171, Ack: 86, Len: 62
TPKT, Version: 3, Length: 62
Q.931
H.225.0 CS

No.     Time                          Source                Destination           Protocol Length Info                                                            新規列
     54 2023-09-15 15:09:54.567049    172.31.237.13         172.20.100.3          TCP      54     13926 → 61443 [ACK] Seq=1094 Ack=233 Win=511 Len=0            54

Frame 54: 54 bytes on wire (432 bits), 54 bytes captured (432 bits)
Ethernet II, Src: ToshibaC_f7:38:1e (68:45:f1:f7:38:1e), Dst: IETF-VRRP-VRID_0a (00:00:5e:00:01:0a)
Internet Protocol Version 4, Src: 172.31.237.13, Dst: 172.20.100.3
Transmission Control Protocol, Src Port: 13926, Dst Port: 61443, Seq: 1094, Ack: 233, Len: 0

No.     Time                          Source                Destination           Protocol Length Info                                                            新規列
     55 2023-09-15 15:09:54.567387    172.20.100.3          172.31.237.13         H.225.0  98     CS: empty                                                       55

Frame 55: 98 bytes on wire (784 bits), 98 bytes captured (784 bits)
Ethernet II, Src: Yamaha_6f:82:c3 (ac:44:f2:6f:82:c3), Dst: ToshibaC_f7:38:1e (68:45:f1:f7:38:1e)
Internet Protocol Version 4, Src: 172.20.100.3, Dst: 172.31.237.13
Transmission Control Protocol, Src Port: 61443, Dst Port: 13926, Seq: 233, Ack: 86, Len: 44
TPKT, Version: 3, Length: 44
Q.931
H.225.0 CS

No.     Time                          Source                Destination           Protocol Length Info                                                            新規列
     56 2023-09-15 15:09:54.568112    172.20.100.3          172.31.237.13         H.225.0  159    CS: facility OpenLogicalChannel                                 56

Frame 56: 159 bytes on wire (1272 bits), 159 bytes captured (1272 bits)
Ethernet II, Src: Yamaha_6f:82:c3 (ac:44:f2:6f:82:c3), Dst: ToshibaC_f7:38:1e (68:45:f1:f7:38:1e)
Internet Protocol Version 4, Src: 172.20.100.3, Dst: 172.31.237.13
Transmission Control Protocol, Src Port: 61443, Dst Port: 13926, Seq: 277, Ack: 86, Len: 105
TPKT, Version: 3, Length: 105
Q.931
H.225.0 CS

No.     Time                          Source                Destination           Protocol Length Info                                                            新規列
     57 2023-09-15 15:09:54.568245    172.31.237.13         172.20.100.3          TCP      54     13926 → 61443 [ACK] Seq=1094 Ack=382 Win=510 Len=0            57

Frame 57: 54 bytes on wire (432 bits), 54 bytes captured (432 bits)
Ethernet II, Src: ToshibaC_f7:38:1e (68:45:f1:f7:38:1e), Dst: IETF-VRRP-VRID_0a (00:00:5e:00:01:0a)
Internet Protocol Version 4, Src: 172.31.237.13, Dst: 172.20.100.3
Transmission Control Protocol, Src Port: 13926, Dst Port: 61443, Seq: 1094, Ack: 382, Len: 0

No.     Time                          Source                Destination           Protocol Length Info                                                            新規列
     58 2023-09-15 15:09:54.598660    172.20.100.3          172.31.237.13         TCP      60     61443 → 13926 [ACK] Seq=382 Ack=1094 Win=8680 Len=0           58

Frame 58: 60 bytes on wire (480 bits), 60 bytes captured (480 bits)
Ethernet II, Src: Yamaha_6f:82:c3 (ac:44:f2:6f:82:c3), Dst: ToshibaC_f7:38:1e (68:45:f1:f7:38:1e)
Internet Protocol Version 4, Src: 172.20.100.3, Dst: 172.31.237.13
Transmission Control Protocol, Src Port: 61443, Dst Port: 13926, Seq: 382, Ack: 1094, Len: 0

No.     Time                          Source                Destination           Protocol Length Info                                                            新規列
     59 2023-09-15 15:09:54.602019    172.20.100.103        172.31.237.13         RTP      214    PT=ITU-T G.711 PCMU, SSRC=0x28B8A538, Seq=1, Time=0             59

Frame 59: 214 bytes on wire (1712 bits), 214 bytes captured (1712 bits)
Ethernet II, Src: Yamaha_6f:82:c3 (ac:44:f2:6f:82:c3), Dst: ToshibaC_f7:38:1e (68:45:f1:f7:38:1e)
Internet Protocol Version 4, Src: 172.20.100.103, Dst: 172.31.237.13
User Datagram Protocol, Src Port: 42296, Dst Port: 2048
Real-Time Transport Protocol

No.     Time                          Source                Destination           Protocol Length Info                                                            新規列
     60 2023-09-15 15:09:54.621979    172.20.100.103        172.31.237.13         RTP      214    PT=ITU-T G.711 PCMU, SSRC=0x28B8A538, Seq=2, Time=160           60

Frame 60: 214 bytes on wire (1712 bits), 214 bytes captured (1712 bits)
Ethernet II, Src: Yamaha_6f:82:c3 (ac:44:f2:6f:82:c3), Dst: ToshibaC_f7:38:1e (68:45:f1:f7:38:1e)
Internet Protocol Version 4, Src: 172.20.100.103, Dst: 172.31.237.13
User Datagram Protocol, Src Port: 42296, Dst Port: 2048
Real-Time Transport Protocol

No.     Time                          Source                Destination           Protocol Length Info                                                            新規列
